{
  "schema_version": "v1",
  "item_id": "auction-2024-97439-001",
  "case_no": "2024타경97439",
  "source_type": "court_auction",
  "status": "candidate",
  "priority": 1,
  "watchlist": true,
  "created_at": "2026-04-21T19:05:00+09:00",
  "updated_at": "2026-04-22T08:10:00+09:00",
  "property": {
    "court": "수원지방법원 본원",
    "address": "경기도 수원시 팔달구 인계동 303-3 수정아파트 1동 3층 311호",
    "region": "수원",
    "sub_region": "팔달구",
    "dong": "인계동",
    "asset_type": "아파트",
    "use_type": "주거용",
    "area_sqm": 148.85,
    "land_area_sqm": 42.76,
    "floor": 3,
    "building_name": "수정아파트",
    "unit_label": "1동 3층 311호"
  },
  "auction": {
    "appraisal_price": 361000000,
    "minimum_price": 252700000,
    "minimum_ratio_pct": 70.0,
    "bid_date": "2026-06-09",
    "fail_count": 1,
    "bid_deposit_rate_pct": 10,
    "bid_deposit_amount": 25270000,
    "state_code": "10",
    "state_label": "공고"
  },
  "market": {
    "comparison_type": "exact",
    "market_price_avg": 347000000,
    "market_price_median": 347000000,
    "market_price_latest": 347000000,
    "comparison_sample_count": 1,
    "minimum_vs_avg_pct": -27.18,
    "appraisal_vs_avg_pct": 4.03,
    "price_merit_score": 7,
    "price_merit_label": "좋음",
    "comparison_basis": "동일 단지 최근 실거래 비교"
  },
  "rights": {
    "special_rights": [],
    "tenant_exists": true,
    "senior_tenant": false,
    "tenant_deposit": 5000000,
    "move_in_date": null,
    "fixed_date": null,
    "dividend_request_date": null,
    "base_right_type": "근저당권설정",
    "base_right_amount": 120000000,
    "rights_risk_score": 3,
    "rights_risk_level": "low",
    "rights_risk_summary": "특수권리 표시 없음. 공개 정보상 큰 인수 리스크는 낮아 보임.",
    "takeover_risk": false
  },
  "occupancy": {
    "occupancy_status": "unknown",
    "occupancy_summary": "전입세대 없음. 정확한 점유관계 추가 확인 필요",
    "eviction_difficulty_score": 4,
    "eviction_difficulty_level": "medium",
    "occupancy_risk_level": "medium",
    "occupancy_risk_summary": "명도 자체는 복잡하지 않을 수 있으나 현장 재확인 필요"
  },
  "cost": {
    "acquisition_tax_est": 5600000,
    "legal_cost_est": 1500000,
    "repair_cost_est": 4000000,
    "eviction_cost_est": 1500000,
    "holding_cost_est": 2500000,
    "broker_fee_sell_est": 2800000,
    "total_cost_est": 267900000,
    "loan_assumption_ltv_pct": 72,
    "required_cash_est": 79000000,
    "budget_fit": true,
    "budget_fit_label": "가능",
    "bid_price_est": 252000000,
    "contingency_cost_est": 7560000,
    "total_cash_needed_est": 79000000,
    "user_budget": 80000000,
    "budget_comment": "현재 자기자금 기준으로 진입 가능 범위입니다."
  },
  "strategy": {
    "bid_price_conservative": 240000000,
    "bid_price_neutral": 252000000,
    "bid_price_aggressive": 260000000,
    "expected_margin_pct": 10.2,
    "exit_strategy": "대형 평형 실수요자 대상 일반 매도",
    "holding_period_est_months": 5,
    "final_opinion": "예산 범위 안에서 권리와 가격의 균형이 좋아 실전 후보 1순위",
    "recommendation": "review"
  },
  "links": {
    "raw_report_md": "raw/2026-04-21-수원-경공매-분석.md",
    "detail_page": "https://madangs.com/caview?m_code=1020240097439001",
    "source_urls": [
      "https://madangs.com/caview?m_code=1020240097439001",
      "https://rt.molit.go.kr"
    ]
  },
  "tags": [
    "수원",
    "아파트",
    "권리낮음",
    "예산적합",
    "대형평형"
  ],
  "notes": [
    "동일 단지 실거래 확인 가능",
    "환금성은 59㎡형보다 느릴 수 있음"
  ],
  "checklist": {
    "completion_pct": 70,
    "blockers": [
      "전입세대/점유 확인"
    ],
    "items": [
      {
        "id": "registry",
        "label": "등기부 확인",
        "status": "done",
        "importance": "high",
        "note": "확인 완료"
      },
      {
        "id": "base_right",
        "label": "말소기준권리 확인",
        "status": "done",
        "importance": "high",
        "note": "확인 완료"
      },
      {
        "id": "senior_tenant",
        "label": "선순위 임차인 여부 확인",
        "status": "done",
        "importance": "high",
        "note": "확인 완료"
      },
      {
        "id": "occupancy",
        "label": "전입세대/점유 확인",
        "status": "todo",
        "importance": "high",
        "note": "추가 확인 필요"
      },
      {
        "id": "management_fee",
        "label": "관리비 체납 확인",
        "status": "todo",
        "importance": "medium",
        "note": "추가 확인 필요"
      },
      {
        "id": "site_visit",
        "label": "임장 여부 확인",
        "status": "todo",
        "importance": "medium",
        "note": "추가 확인 필요"
      },
      {
        "id": "market_compare",
        "label": "실거래 3건 이상 비교",
        "status": "done",
        "importance": "high",
        "note": "확인 완료"
      },
      {
        "id": "repair_scope",
        "label": "수리 필요 범위 확인",
        "status": "done",
        "importance": "medium",
        "note": "확인 완료"
      },
      {
        "id": "max_bid",
        "label": "입찰가 상한 설정",
        "status": "done",
        "importance": "high",
        "note": "확인 완료"
      },
      {
        "id": "exit_strategy",
        "label": "출구전략 작성",
        "status": "done",
        "importance": "medium",
        "note": "확인 완료"
      }
    ]
  },
  "decision_summary": {
    "title": "입찰 검토",
    "one_line": "시세 메리트가 좋고 권리 구조도 무난해 입문자도 검토 가능하지만 점유 확인은 반드시 필요합니다.",
    "beginner_fit_level": "good",
    "beginner_fit_reason": "권리 위험이 낮고 예산 범위 안이지만 현장 점유 확인 전 최종 입찰은 금물입니다."
  },
  "risk_flags": {
    "pass_reasons": [],
    "caution_reasons": [
      "점유 확인 필요",
      "대형 평형 환금성 점검"
    ],
    "red_flags": []
  }
}
